{
  "$schema": "../../schemas/recipe.schema.json",
  "schema_version": "1.0.0",
  "id": "creamy-lemon-chicken-pasta",
  "name": "Creamy Lemon Chicken Pasta",
  "subtitle": "Baked farfalle with lemon cream sauce",
  "description": "Seasoned chicken and bow-tie pasta are combined with a creamy lemon sauce, topped with Parmesan, and baked until lightly browned.",
  "meal_type": "main",
  "cuisine": "Italian",
  "yield": {
    "quantity": 6,
    "unit": "servings"
  },
  "times": {
    "prep_minutes": 15,
    "cook_minutes": 45
  },
  "ingredients": [
    {
      "ingredient_id": "skinless",
      "item": "skinless",
      "quantity": 2,
      "preparation": "boneless chicken breast halves"
    },
    {
      "ingredient_id": "kosher-salt",
      "item": "salt",
      "quantity": 0.5,
      "unit": "teaspoon",
      "preparation": "or to taste"
    },
    {
      "ingredient_id": "ground-black-pepper",
      "item": "ground black pepper",
      "quantity": 0.125,
      "unit": "teaspoon",
      "preparation": "or to taste"
    },
    {
      "ingredient_id": "farfalle-bow-tie-pasta",
      "item": "farfalle (bow-tie) pasta",
      "quantity": 1,
      "unit": "package",
      "preparation": "16 ounce"
    },
    {
      "ingredient_id": "butter",
      "item": "unsalted butter",
      "quantity": 2,
      "unit": "tablespoons"
    },
    {
      "ingredient_id": "olive-oil",
      "item": "olive oil",
      "quantity": 2,
      "unit": "tablespoons"
    },
    {
      "ingredient_id": "dry-white-wine",
      "item": "dry white wine",
      "quantity": 0.5,
      "unit": "cup"
    },
    {
      "ingredient_id": "garlic",
      "item": "garlic",
      "quantity": 3,
      "unit": "cloves",
      "preparation": "minced, or more to taste"
    },
    {
      "ingredient_id": "lemon",
      "item": "lemon",
      "quantity": 1,
      "preparation": "zested and juiced, divided"
    },
    {
      "ingredient_id": "cream-cheese",
      "item": "cream cheese",
      "quantity": 0.5,
      "unit": "package",
      "preparation": "8 ounce"
    },
    {
      "ingredient_id": "flour",
      "item": "all-purpose flour",
      "quantity": 2,
      "unit": "tablespoons"
    },
    {
      "ingredient_id": "sour-cream",
      "item": "sour cream",
      "quantity": 1,
      "unit": "cup"
    },
    {
      "ingredient_id": "chicken-stock",
      "item": "chicken stock",
      "quantity": 2,
      "unit": "cups",
      "preparation": "or more as needed"
    },
    {
      "ingredient_id": "dried-parsley",
      "item": "dried parsley",
      "quantity": 1,
      "unit": "tablespoon"
    },
    {
      "ingredient_id": "dried-thyme",
      "item": "dried thyme",
      "quantity": 1,
      "unit": "teaspoon"
    },
    {
      "ingredient_id": "red-pepper",
      "item": "red pepper",
      "quantity": 0.5,
      "unit": "teaspoon",
      "preparation": "crushed, or to taste"
    },
    {
      "ingredient_id": "salt-and-ground-black-pepper-to-taste",
      "item": "salt and ground black pepper to taste"
    },
    {
      "ingredient_id": "grated-parmesan-cheese",
      "item": "grated Parmesan cheese",
      "quantity": 0.75,
      "unit": "cup",
      "preparation": "divided"
    }
  ],
  "instructions": [
    {
      "step": 1,
      "text": "Heat the oven to 375°F. Season the chicken with salt and ground black pepper."
    },
    {
      "step": 2,
      "text": "Cook the farfalle in simmering water for 6 minutes, then drain and set aside.",
      "timer_minutes": 6
    },
    {
      "step": 3,
      "text": "Heat the butter and olive oil in a large ovenproof skillet. Cook the seasoned chicken until lightly browned, then continue until a thermometer inserted into the thickest part reaches 165°F. Transfer the chicken to a plate.",
      "timer_minutes": 5
    },
    {
      "step": 4,
      "text": "Pour in the wine and simmer briefly. Add the garlic and part of the lemon zest and juice; cook until fragrant.",
      "timer_minutes": 2
    },
    {
      "step": 5,
      "text": "Warm the cream cheese until softened. Whisk it with the flour and sour cream, then stir in the chicken stock, dried parsley, dried thyme, crushed red pepper, and salt and ground black pepper to taste."
    },
    {
      "step": 6,
      "text": "Add the sauce mixture to the skillet and simmer, stirring, until thickened. Add more chicken stock if needed for a pourable sauce."
    },
    {
      "step": 7,
      "text": "Stir in the remaining lemon zest and juice. Cut the chicken into bite-size pieces and return it to the skillet with the drained pasta. Mix in part of the Parmesan."
    },
    {
      "step": 8,
      "text": "Top with the remaining Parmesan and bake for 15 minutes. Continue baking for about 10 minutes, until lightly browned and hot throughout.",
      "timer_minutes": 10
    }
  ],
  "tags": [
    "dinner",
    "pasta",
    "chicken",
    "baked",
    "italian-inspired"
  ],
  "seasons": [
    "year-round"
  ],
  "allergens": [
    "milk",
    "wheat"
  ],
  "equipment": [
    "large ovenproof skillet",
    "large pot",
    "whisk",
    "food thermometer"
  ],
  "source": {
    "name": "Allrecipes",
    "url": "https://www.allrecipes.com/recipe/280214/creamy-lemon-chicken-pasta/",
    "adapted": true
  },
  "created_at": "2026-09-08",
  "updated_at": "2026-09-08",
  "normalization": {
    "source_text_hash": "862f0032fb81a0fed73e35ae485664f7e0c830dab9bec41cd5a906e0dcd56bc3",
    "normalized_text_hash": "1638994d2d6789413c1e0cfb64d60fe49762b22602968001a0b60f611d179f1f",
    "model": "gpt-5.6-luna",
    "model_version": "gpt-5.6-luna",
    "prompt_version": "3.0.0",
    "transformed_at": "2026-09-04T07:39:37.727Z",
    "semantic_similarity": 3,
    "structural_similarity": 9,
    "requires_review": false,
    "source_review_status": "passed"
  }
}
