{
  "$schema": "../../schemas/recipe.schema.json",
  "schema_version": "1.0.0",
  "id": "sour-cream-banana-bread",
  "name": "Sour Cream Banana Bread",
  "subtitle": "Moist banana loaf with a cinnamon-walnut topping",
  "description": "A tender quick bread made with ripe bananas, sour cream, and chopped walnuts, finished with a lightly spiced sugar crust.",
  "meal_type": "baked-good",
  "cuisine": "American",
  "yield": {
    "quantity": 12,
    "unit": "servings"
  },
  "times": {
    "prep_minutes": 15,
    "cook_minutes": 75,
    "inactive_minutes": 30
  },
  "ingredients": [
    {
      "ingredient_id": "very-ripe-bananas",
      "item": "very ripe bananas",
      "quantity": 4,
      "preparation": "divided"
    },
    {
      "ingredient_id": "sugar",
      "item": "white sugar",
      "quantity": 1,
      "unit": "cup"
    },
    {
      "ingredient_id": "butter",
      "item": "butter",
      "quantity": 0.75,
      "unit": "cup",
      "preparation": "melted and cooled"
    },
    {
      "ingredient_id": "egg",
      "item": "eggs",
      "quantity": 2,
      "unit": "large"
    },
    {
      "ingredient_id": "sour-cream",
      "item": "sour cream",
      "quantity": 0.33333334326744,
      "unit": "cup"
    },
    {
      "ingredient_id": "vanilla-extract",
      "item": "vanilla extract",
      "quantity": 1,
      "unit": "teaspoon"
    },
    {
      "ingredient_id": "flour",
      "item": "all-purpose flour",
      "quantity": 2,
      "unit": "cups"
    },
    {
      "ingredient_id": "baking-powder",
      "item": "baking powder",
      "quantity": 1.5,
      "unit": "teaspoons"
    },
    {
      "ingredient_id": "kosher-salt",
      "item": "salt",
      "quantity": 0.5,
      "unit": "teaspoon"
    },
    {
      "ingredient_id": "walnuts",
      "item": "walnuts",
      "quantity": 0.5,
      "unit": "cup",
      "preparation": "chopped"
    },
    {
      "ingredient_id": "sugar",
      "item": "white sugar",
      "quantity": 2,
      "unit": "teaspoons"
    },
    {
      "ingredient_id": "ground-cinnamon",
      "item": "ground cinnamon",
      "quantity": 0.5,
      "unit": "teaspoon"
    }
  ],
  "instructions": [
    {
      "step": 1,
      "text": "Preheat the oven to 350°F. Prepare a loaf pan for the batter."
    },
    {
      "step": 2,
      "text": "Mash part of the bananas and reserve the remaining bananas for folding in later."
    },
    {
      "step": 3,
      "text": "Whisk the mashed bananas, 1 cup sugar, and sour cream for 3 minutes. Whisk in the cooled butter, eggs, and vanilla.",
      "timer_minutes": 3
    },
    {
      "step": 4,
      "text": "In a separate bowl, whisk together the flour, baking powder, and salt. Fold the dry mixture into the wet mixture just until combined, then fold in the reserved bananas and walnuts."
    },
    {
      "step": 5,
      "text": "Transfer the batter to the prepared pan."
    },
    {
      "step": 6,
      "text": "Stir 2 teaspoons sugar with the cinnamon, then sprinkle the mixture over the batter."
    },
    {
      "step": 7,
      "text": "Bake until golden brown, about 60 minutes; continue baking as needed to reach the stated 75-minute cook time.",
      "timer_minutes": 60
    },
    {
      "step": 8,
      "text": "Cool in the pan for 10 minutes, then let the loaf cool further before slicing.",
      "timer_minutes": 10
    }
  ],
  "tags": [
    "banana-bread",
    "quick-bread",
    "american",
    "baking"
  ],
  "seasons": [
    "year-round"
  ],
  "dietary": [
    "vegetarian"
  ],
  "allergens": [
    "milk",
    "eggs",
    "tree-nuts",
    "wheat"
  ],
  "equipment": [
    "oven",
    "loaf pan",
    "mixing bowls",
    "whisk"
  ],
  "source": {
    "name": "Allrecipes",
    "url": "https://www.allrecipes.com/recipe/229353/sour-cream-banana-bread/",
    "adapted": true
  },
  "created_at": "2026-09-08",
  "updated_at": "2026-09-08",
  "normalization": {
    "source_text_hash": "52cc00f7e683afa5e1230709c7a865191574e9581b62f268e84e203c25258f3e",
    "normalized_text_hash": "b39392dc85d7b585ebdc654ab51460f96a781ef273d441feeaf4a5df0f0bd7f2",
    "model": "gpt-5.6-luna",
    "model_version": "gpt-5.6-luna",
    "prompt_version": "3.0.0",
    "transformed_at": "2026-09-04T18:08:51.416Z",
    "semantic_similarity": 6,
    "structural_similarity": 10,
    "requires_review": false,
    "source_review_status": "passed"
  }
}
