{
  "$schema": "../../schemas/recipe.schema.json",
  "schema_version": "1.0.0",
  "id": "bang-bang-cauliflower",
  "name": "Bang Bang Cauliflower",
  "subtitle": "Crisp baked cauliflower with a spicy-sweet glaze",
  "description": "Small cauliflower florets are coated in seasoned crumbs, baked until golden, and finished with a bright chili sauce and fresh garnishes.",
  "meal_type": "side",
  "cuisine": "Chinese",
  "yield": {
    "quantity": 4,
    "unit": "as a starter"
  },
  "times": {
    "prep_minutes": 25,
    "cook_minutes": 30
  },
  "ingredients": [
    {
      "ingredient_id": "flour",
      "item": "plain flour",
      "quantity": 125,
      "unit": "g"
    },
    {
      "ingredient_id": "paprika",
      "item": "paprika",
      "quantity": 1,
      "unit": "tsp"
    },
    {
      "ingredient_id": "garlic-granules",
      "item": "garlic granules",
      "quantity": 1,
      "unit": "tsp"
    },
    {
      "ingredient_id": "milk-dairy-or-non-dairy",
      "item": "milk (dairy or non-dairy)",
      "quantity": 200,
      "unit": "ml"
    },
    {
      "ingredient_id": "panko-breadcrumbs",
      "item": "panko breadcrumbs",
      "quantity": 75,
      "unit": "g"
    },
    {
      "ingredient_id": "head-of-cauliflower-cut-into-small-florets-350g-prepped-weight",
      "item": "head of cauliflower cut into small florets (350g prepped weight)",
      "quantity": 1,
      "unit": "small"
    },
    {
      "ingredient_id": "sesame-seeds",
      "item": "sesame seeds",
      "quantity": 1,
      "unit": "tbsp",
      "preparation": "toasted"
    },
    {
      "ingredient_id": "red-chilli-finely-sliced",
      "item": "red chilli finely sliced",
      "quantity": 1,
      "preparation": "to serve"
    },
    {
      "ingredient_id": "spring-onions-finely-sliced",
      "item": "spring onions finely sliced",
      "quantity": 4,
      "preparation": "to serve"
    },
    {
      "ingredient_id": "sweet-chilli-sauce",
      "item": "sweet chilli sauce",
      "quantity": 80,
      "unit": "g"
    },
    {
      "ingredient_id": "sriracha",
      "item": "sriracha",
      "quantity": 20,
      "unit": "g"
    },
    {
      "ingredient_id": "lime-juiced",
      "item": "lime juiced",
      "quantity": 1
    },
    {
      "ingredient_id": "maple-syrup-or-honey",
      "item": "maple syrup or honey",
      "quantity": 1,
      "unit": "tsp"
    }
  ],
  "instructions": [
    {
      "step": 1,
      "text": "Preheat the oven and prepare a baking tray."
    },
    {
      "step": 2,
      "text": "Mix the plain flour, paprika, and garlic granules in one bowl. Whisk the milk in a second bowl until smooth, and place the panko breadcrumbs in a third."
    },
    {
      "step": 3,
      "text": "Dip each cauliflower floret in the milk, coat it with the seasoned flour, dip it briefly again, then press it into the panko. Arrange the coated florets on the tray."
    },
    {
      "step": 4,
      "text": "Bake until golden brown and crisp.",
      "timer_minutes": 30
    },
    {
      "step": 5,
      "text": "Stir together the sweet chilli sauce, sriracha, lime juice, and maple syrup or honey. Toss the baked cauliflower with the sauce."
    },
    {
      "step": 6,
      "text": "Top with the toasted sesame seeds, sliced red chilli, and spring onions, then serve."
    }
  ],
  "tags": [
    "side-dish",
    "starter",
    "chinese",
    "cauliflower",
    "spicy",
    "baked",
    "crispy"
  ],
  "seasons": [
    "year-round"
  ],
  "dietary": [
    "vegetarian"
  ],
  "allergens": [
    "milk",
    "wheat",
    "sesame"
  ],
  "equipment": [
    "baking tray",
    "three mixing bowls"
  ],
  "source": {
    "name": "BBC Good Food",
    "url": "https://www.bbcgoodfood.com/recipes/bang-bang-cauliflower",
    "adapted": true
  },
  "created_at": "2026-09-08",
  "updated_at": "2026-09-08",
  "normalization": {
    "source_text_hash": "15d904f1d2668fedcc45ffa837bbdd8574b1fde269ae4a6ed51846ed90fe1760",
    "normalized_text_hash": "9dc5b49e20b76620f128e7a9e7d79a1464c5a123aab6740eca1df4d262161c87",
    "model": "gpt-5.6-luna",
    "model_version": "gpt-5.6-luna",
    "prompt_version": "3.0.0",
    "transformed_at": "2026-09-05T04:09:34.702Z",
    "semantic_similarity": 3,
    "structural_similarity": 12,
    "requires_review": false,
    "source_review_status": "passed"
  }
}
