{
  "$schema": "../../schemas/recipe.schema.json",
  "schema_version": "1.0.0",
  "id": "kale-and-quinoa-salad",
  "name": "Kale and Quinoa Salad",
  "subtitle": "A bright grain-and-greens salad with pecans, currants, and feta",
  "description": "Tender quinoa and chopped kale are tossed with a lemon-mustard dressing, crunchy pecans, sweet currants, and crumbled feta.",
  "meal_type": "salad",
  "cuisine": "American",
  "yield": {
    "quantity": 6,
    "unit": "servings"
  },
  "times": {
    "prep_minutes": 5,
    "cook_minutes": 15,
    "inactive_minutes": 35
  },
  "ingredients": [
    {
      "ingredient_id": "water",
      "item": "water",
      "quantity": 2,
      "unit": "cups"
    },
    {
      "ingredient_id": "quinoa",
      "item": "quinoa",
      "quantity": 1,
      "unit": "cup"
    },
    {
      "ingredient_id": "leaves-kale",
      "item": "leaves kale",
      "quantity": 10,
      "preparation": "cut into small pieces"
    },
    {
      "ingredient_id": "olive-oil",
      "item": "olive oil",
      "quantity": 3,
      "unit": "tablespoons"
    },
    {
      "ingredient_id": "lemon-juice",
      "item": "lemon juice",
      "quantity": 2,
      "unit": "tablespoons"
    },
    {
      "ingredient_id": "dijon-mustard",
      "item": "Dijon mustard",
      "quantity": 1,
      "unit": "teaspoon"
    },
    {
      "ingredient_id": "garlic",
      "item": "garlic clove",
      "quantity": 1,
      "unit": "large",
      "preparation": "minced"
    },
    {
      "ingredient_id": "fresh-cracked-black-pepper",
      "item": "fresh cracked black pepper",
      "quantity": 1,
      "unit": "teaspoon"
    },
    {
      "ingredient_id": "ground-sea-salt",
      "item": "ground sea salt",
      "quantity": 0.5,
      "unit": "teaspoon"
    },
    {
      "ingredient_id": "pecans",
      "item": "pecans",
      "quantity": 1,
      "unit": "cup"
    },
    {
      "ingredient_id": "currants",
      "item": "currants",
      "quantity": 1,
      "unit": "cup"
    },
    {
      "ingredient_id": "crumbled-feta-cheese",
      "item": "crumbled feta cheese",
      "quantity": 0.75,
      "unit": "cup"
    }
  ],
  "instructions": [
    {
      "step": 1,
      "text": "Bring the water to a simmer in a saucepan. Stir in the quinoa, cover, and cook for 12 minutes.",
      "timer_minutes": 12
    },
    {
      "step": 2,
      "text": "Remove the quinoa from the heat and let it stand, covered, for 5 minutes. Cool for 35 minutes.",
      "timer_minutes": 35
    },
    {
      "step": 3,
      "text": "Whisk the olive oil, lemon juice, Dijon mustard, minced garlic, black pepper, and sea salt into a dressing."
    },
    {
      "step": 4,
      "text": "Place the chopped kale in a large bowl and gently massage it until slightly softened."
    },
    {
      "step": 5,
      "text": "Add the cooled quinoa, pecans, currants, and feta to the kale. Pour over the dressing and toss to combine."
    }
  ],
  "tags": [
    "salad",
    "side-dish",
    "lunch",
    "dinner",
    "american"
  ],
  "seasons": [
    "year-round"
  ],
  "dietary": [
    "vegetarian",
    "gluten-free"
  ],
  "allergens": [
    "milk",
    "tree-nuts"
  ],
  "equipment": [
    "saucepan",
    "mixing bowl",
    "whisk"
  ],
  "source": {
    "name": "Allrecipes",
    "url": "https://www.allrecipes.com/recipe/229244/kale-and-quinoa-salad/",
    "adapted": true
  },
  "created_at": "2026-09-08",
  "updated_at": "2026-09-08",
  "normalization": {
    "source_text_hash": "38b3a1ccbbc55f7d772b53933b9dee92b3177643791fecc91c9f68b533c205d8",
    "normalized_text_hash": "b26d1ac57891d273f01c243e7b0bc60f331cde52f15e0118b69686586e45679d",
    "model": "gpt-5.6-luna",
    "model_version": "gpt-5.6-luna",
    "prompt_version": "3.0.0",
    "transformed_at": "2026-09-04T11:32:43.779Z",
    "semantic_similarity": 8,
    "structural_similarity": 21,
    "requires_review": false,
    "source_review_status": "passed"
  }
}
